summary,link,published,title,article_text,sentiment
The creator of Moore’s law acknowledged it couldn’t “continue forever“—but underestimated how human ingenuity keeps powering advances.,https://finance.yahoo.com/news/creator-moore-law-said-couldn-080000132.html?.tsrc=rss,"Sat, 12 Oct 2024 08:00:00 +0000",The creator of Moore’s law said it couldn’t ‘continue forever’—and would be astounded by the chips Intel and its competitors are making now,"Ive bet the whole company on 18A, Intel CEO Pat Gelsinger told an interviewer earlier this yeara baffling statement to non-techies, but the story behind it is understandable to anyone, and worth knowing. Its an uplifting reminder of human ingenuitys endless reach, relevant to challenges of every kind. As to what on earth Gelsinger was talking about: Intel is one of the worlds preeminent designers and manufacturers of computer chips, and the 18A is a chip that Intel intends to start making in volume next year. It will be the most advanced chip ever, though Taiwan Semiconductor Manufacturing Co. (TSMC), the worlds largest chipmaker, will next year start making in volume a chip it claims at least matches the 18A. That designation, 18A, denotes the density of transistors on the chip, among other things, and the smaller the number, the higher the density. This is the smallest number of any chip yet; 18A means 18 angstroms, an angstrom being one ten-billionth of a meter. The rest of the industry labels chips by nanometers; TSMCs new chip is 2 nm, and by that measure the 18A would be 1.8 nm. Even without understanding the production process, we stand in awe of its infinitesimal scale. Chipmakers now work at the level of atoms. An atom of silicon is 0.21 nanometers wide, for example. Thats enough atomic physics. The important point is that these new chips are more than just astounding. They were supposed to be impossible. The famous Moores law said the number of transistors on a chipbasically transistor densitydoubles every two years or so. It proved accurate for decades, but even Gordon Moore himself acknowledged, It cant continue forever. The laws of physics would allow transistors to get only so small. The crucial question was exactly how small. Experts have been confidently and incorrectly predicting the answer for years. Some said 2010 would be the end, when the leading-edge chip was 28 nm. After chipmakers broke through that level, a new set of prognosticators saw 2020 as the limit, when the leading edge was 5 nm. Yet now even Intels 1.8 nm chip is not the end of the line. The companys next chip1.4 nmis in development. How can this be? The answer is in two parts, both of which are relevant to human ingenuity broadly.  The chipmakers and their suppliers kept finding innovative new ways to extend the life of Moores law, which prognosticators couldnt foresee. For example, chipmakers figured out how to stack transistor components on top of each other, packing more computing power into a given space. Another example: Chipmaking involves shining light through a mask onto a silicon wafer, but as transistors got ever more microscopic, it was difficult to use light with wavelengths short enough to print sharp patterns. ASML, a Dutch maker of chipmaking equipment, developed machines that could handle the necessary extreme ultraviolet light, and todays leading-edge chips cant be made without those machines. To produce the 18A, Intel CEO Gelsinger negotiated with ASML to be first to receive the companys latest model.  Companies went around Moores law. Adding more transistors isnt the only way to get more value from a chip. Advanced algorithms and software now help users get better performance out of their computers chips. Chipmakers are also producing chips designed for specific applications, such as AI. Those chips arent the best at everything, but theyre great for specific tasks. Broadcom, the tech company that has quietly become one of the worlds most valuable companies, designs many such chips. Strictly speaking, Moores law is no longer valid. As transistors approach atomic scale, the number of transistors on a chip isnt doubling every two years. But so what? Computing continues to advance at a scorching pacewith quantum computing and other wonders on the horizonand thats what counts. The saga of Moores law is an example of how we almost always underestimate human ingenuity. Early researchers in computer translation of languages were pessimistic that the field could ever progress beyond its nearly useless state as of the mid-1960s, yet today your phone has a free app that translates to and from over 100 languages very well, and its continually improving. MIT professor Hubert Dreyfus, in a 1972 book called What Computers Cant Do, saw little hope that computers could make significant progress in playing chess beyond the mediocre level then achieved. Yet an IBM computer beat world champion Garry Kasparov in 1997, and Kasparov tells me the free chess app on your phone today is more powerful than the computer that defeated him. Theres no telling what will happen with Pat Gelsingers rescue plan for Intel or with any individual quest. But broadly, over time, we can be sure at least two things will be infinite: human desires and human ingenuity. Well always be unsatisfied, with problems to solve, and well always find astonishing, unexpected solutions to at least some of them. In this tumultuous world, thats not a bad basis for optimism. This story was originally featured on Fortune.com Sign in to access your portfolio",POSITIVE
"Intel shares have largely been disappointing in 2024, unable to join the semiconductor trade and down more than 50%. But is it time for investors to revisit the stock?",https://finance.yahoo.com/news/intel-intc-shares-worth-another-141500644.html?.tsrc=rss,"Fri, 11 Oct 2024 14:15:00 +0000",Are Intel (INTC) Shares Worth Another Look?,"Intel INTC shares have largely been disappointing in 2024, unable to fully join the semiconductor trade and down more than 50%. Quarterly results have added fuel to the fire sale, with the stock unable to find any meaningful traction post-earnings. Below is a chart illustrating the YTD performance of Intel shares relative to the S&P 500, with its quarterly releases illustrated by the circled arrows. Image Source: Zacks Investment Research Given the steep decline from highs, could it finally be time to go on the offensive and pick up some shares? Lets take a closer look. Currently, Intel carries a Zacks Rank #4 (Sell), indicating bearish earnings estimate revisions from analysts. Expectations for its current fiscal year have been notably negative, with the $0.27 Zacks Consensus EPS estimate down 85% over the last year. The negative revisions, caused by unfavorable quarterly results, bode poorly for near-term share performance.  Image Source: Zacks Investment Research Still, its worth noting that CEO Pat Gelsinger remains confident, buying 12.5k shares at a total transaction value of roughly $250k in early August following the latest quarterly print. He noted that second-half trends are more challenging than anticipated but still expects the company to restrengthen its position in the market. Cost-cutting measures have also been a huge focus for the company over recent periods after margin pressures, as we can see in the chart below. In fact, Intel announced a $10 billion cost-savings target earlier in August. Please note that the chart below is on a trailing twelve-month basis. Image Source: Zacks Investment Research Investors should stay on the sidelines until positive earnings estimate revisions roll in, which would signal a meaningful change in sentiment. Earnings expectations for its upcoming release expected on October 24th have already been slashed, with the company now expected to post a loss of -$0.03 per share. Image Source: Zacks Investment Research Stay up-to-date with all quarterly releases: See Zacks Earnings Calendar. Its worth noting that INTC shares have been red-hot over the last month, gaining nearly 20%. While the positive price action has been inspiring, the bulk of the move has likely been fueled by a short squeeze following rumors of buyouts.  For those seeking semiconductor exposure, there are many more positive stories, a list that obviously includes beloved AI-favorite Nvidia NVDA. Nvidia currently sports a Zacks Rank #2 (Buy), with its earnings outlook shifting higher across the board following unbelievable quarterly results. And concerning the top line, Nvidias sales are forecasted to more than double in its current fiscal year. Image Source: Zacks Investment Research Want the latest recommendations from Zacks Investment Research? Today, you can download 7 Best Stocks for the Next 30 Days. Click to get this free report Intel Corporation (INTC) : Free Stock Analysis Report NVIDIA Corporation (NVDA) : Free Stock Analysis Report To read this article on Zacks.com click here. Zacks Investment Research Sign in to access your portfolio",NEGATIVE
Find out what's new with Intel!,https://finance.yahoo.com/news/intels-most-recent-updates-know-140631227.html?.tsrc=rss,"Fri, 11 Oct 2024 14:06:31 +0000","Intel's Most Recent Updates That You Need To Know - Oct. 11, 2024","If you belong to the buying the dip strategy fanbase you might be eyeing on Intel Corp (NASDAQ:INTC). So here's a recap of the recent updates with Intel: Q3 report schedule: Intel's third-quarter financial 2024 will be reported on Thursday, October 31, 2024 after the market closes. And they welcome investors and interested parties to join their earnings call at 2 p.m. PDT on the same day to discuss the results. After the freefall of Intel's stock following the Q2 report result, many investors will be seeking for any sign of hope in the next earnings announcement. Overclaim of Intel's new chip: Intel's Core Ultra 200S series, which are scheduled to be on sale October 24; is claimed to consume less power. A review from CNET revealed otherwise that they had an issue with the power consumption when it was advertised as less power consumption than processors from other companies. Next Generation of Xe3 line: Intel announced that they are working on the next generation of Xe3 graphics and next year's Panther Lake tools will be the first to include the graphics. Another round of layoffs: After hiring one new global channel chief, Dave Guzzi, Intel plans to lay off around 15,000 to 19,000 workers next week and the managers have already turned in the lists of the layoffs. Half of the 15,000 cuts are prepared to get their early retirement and separation benefits, but the other 7,500 employees are potentially left with uncertainty. Single-core Arrow Lake chip testing gave solid results: The example of their Arrow Lake Core Ultra 9 285K which was tested as a pre-release engineering sample gave solid results according to PassMark software. The newest report said that Intel's Arrow Lake processors are worth buying. Collaborations: Intel is doing good with their new 18A chip and decided to invest $25 billion in microchip foundry in Israel. They also had signed a multi-year co-investment with Amazon Web Services (AWS) to design custom AI chips, the project worth multi-billion dollars. AI Playground: Intel has launched AI Playground, a platform to do all-in-one AI capabilities like generate pictures from words, improve image quality, answer questions, summarize documents, and translate text. Worrying Q2 report: In the second quarter of this year, Intel reported a $1.6 billion loss with a towering debt of $53 billion and negative cash flow of $12.58 billion in the trailing twelve months. Disruption to ultra-pure quartz supply chain: Pure quartz is essential for semiconductor production, used to melt polysilicon into computer-chip grade silicon. Hurricane Helene disaster damaged the ultra-pure quartz from Spruce Pine in North Carolina and disrupted the quartz supply chain. Certainly there are many other quartz mines in the world but not with the same quality found in the Spruce Pine. Downgrade rating from analysts: On Wall Street, with only one analyst declaring a Buy, other 26 analysts just wait and see with their Hold rating, 6 already downgraded their ratings to Sell. Deutsche Bank is one example firm that lowered their price target on Intel from $27 to $25. No more sales of Gaudi 3 chip: After working on their Gaudi 3 artificial intelligence (AI) accelerator chip in the last few years, Intel decided to stop their Gaudi 3 chips sales for 2025. Previously Intel planned to ship around 300,000 Gaudi chips for 2025 but they revoke the intention. Normal operations after processor crashes: Intel's Raptor Lake processors crashed due to high voltage that went to the processors. After the root cause was found, the processor was reported to be on normal operations and no damage occurred. Two new processors: TechRadar reported Intel launched The Granite Rapids processor, marketed with a $17,800 price tag, that came with 128 high-performance cores and can reach speeds of up to 3.9 GHz. And there is the Core Ultra 7 GPU from the Lunar Lake lineup processor. The processor is proved to be significantly faster from the Steam Deck's custom processor. Buybacks no longer attractive: Share buyback plans often increase the share prices. But their buyback as of June 29, 2024, with a total value of $110 billion, no longer leverages their shares price. Out of $110 billion, they had only used $92.76 billion and left $7.24 billion remaining to use to buy back their shares.Don't just read the latest news - make informed investment decisions. Visit GuruFocus today and dive deeper into Intel's performance with Charts & Guru Insights This article first appeared on GuruFocus. Sign in to access your portfolio",NEGATIVE
Q1 2025 Aehr Test Systems Earnings Call,https://finance.yahoo.com/news/q1-2025-aehr-test-systems-132654134.html?.tsrc=rss,"Fri, 11 Oct 2024 13:26:54 +0000",Q1 2025 Aehr Test Systems Earnings Call,N/A,UNKNOWN
The new Arrow Lake chips are far more energy efficient than their predecessors.,https://www.fool.com/investing/2024/10/11/intels-new-pc-chips-solve-its-biggest-problem/?source=eptyholnk0000202&utm_source=yahoo-host-full&utm_medium=feed&utm_campaign=article&referring_guid=acf113c9-3b91-4cf2-9984-32e3b0e1c0e7&.tsrc=rss,"Fri, 11 Oct 2024 08:30:00 +0000",Intel's New PC Chips Solve Its Biggest Problem,"Founded in 1993, The Motley Fool is a financial services company dedicated to making the world smarter, happier, and richer. The Motley Fool reaches millions of people every month through our premium investing solutions, free guidance and market analysis on Fool.com, top-rated podcasts, and non-profit The Motley Fool Foundation. Founded in 1993, The Motley Fool is a financial services company dedicated to making the world smarter, happier, and richer. The Motley Fool reaches millions of people every month through our premium investing solutions, free guidance and market analysis on Fool.com, top-rated podcasts, and non-profit The Motley Fool Foundation. 
You're reading a free article with opinions that may differ
from The Motley Fool's Premium Investing Services. Become a Motley Fool member today to
get instant access to our top analyst recommendations, in-depth research, investing resources,
and more. Learn More
 Key Points The new Arrow Lake chips are far more energy efficient than their predecessors. Chip-giant Intel (INTC -2.71%) has managed to keep pace with rival AMD on raw performance in the PC central processing unit (CPU) market over the past few years, but that feat came at a cost. Intel's previous three generations of desktop PC processors -- Alder Lake, Raptor Lake, and Raptor Lake Refresh -- were all built on the Intel 7 manufacturing process. Intel 7 is derived from the company's 10-nanometer (nm) process, which was famously delayed for years. In order to deliver enough performance using inferior manufacturing tech, these chips needed to use far more power than the competition. In benchmarks run by Anandtech earlier this year, Intel's last-generation flagship 14900K chip used about 70% more power than the comparable 7950X CPU from AMD. This is a problem for multiple reasons. First, for anyone building a PC, a power-hungry CPU could require a pricier power supply and a more expensive cooling solution, especially if a GPU is involved. Second, Intel ran into instability issues with its two Raptor Lake families, causing some chips to be permanently damaged. The excessive power usage was likely a factor. Alder Lake, Raptor Lake, and Raptor Lake Refresh helped Intel hold its ground in the PC CPU market, but Intel had pushed power consumption about as high as it could reasonably go. With Arrow Lake, officially known as the Core Ultra 200S series, the company has shifted its focus back to power efficiency. Intel chose to use an advanced manufacturing process from TSMC for Arrow Lake, much like it did for its Lunar Lake laptop chips. Arrow Lake was originally meant to be manufactured on the Intel 20A process, but the company decided to shift resources to Intel 18A, instead. Intel uses its Foveros advanced packaging tech for Arrow Lake, but otherwise, the chip is outsourced. A combination of using the TSMC process and architectural improvements has yielded enormous power-efficiency benefits. Arrow Lake is capable of delivering the same performance as Raptor Lake Refresh while using half the power. In productivity use cases, like video calls and office applications, power consumption drops as much as 58%, compared to Raptor Lake Refresh. In gaming workloads, the flagship Arrow Lake chip delivers roughly the same performance as its predecessor, on average, while consuming substantially less power. Depending on the game, Intel's numbers point to a reduction in total system power usage as high as 165W. A typical gaming PC may use around 600W total, so that's an enormous reduction. Lower power consumption also means less heat. Intel points to an average temperature reduction of 13 degrees Celsius, compared to Raptor Lake Refresh in gaming workloads. For those building a gaming PC, high-end Arrow Lake chips can be paired with less-expensive coolers and cases, compared to Raptor Lake Refresh, since there's much less heat to dissipate. While Arrow Lake isn't quite a slam dunk, mostly because the chips don't deliver much in the way of performance gains for gaming, Intel has managed to greatly reduce or eliminate the huge gap in power efficiency between its chips and those from AMD. Arrow Lake also delivers performance gains across a wide array of applications, although we'll have to wait for third-party reviews later this month to get the full picture. Intel has kept AMD to minimal share gains in the desktop PC CPU market over the past few years thanks to Alder Lake, Raptor Lake, and Raptor Lake Refresh, although the crash in PC sales following the pandemic muddles the picture a bit. As PC sales recover, Arrow Lake should put Intel in a strong competitive position. Timothy Green has positions in Intel. The Motley Fool has positions in and recommends Advanced Micro Devices and Taiwan Semiconductor Manufacturing. The Motley Fool recommends Intel and recommends the following options: short November 2024 $24 calls on Intel. The Motley Fool has a disclosure policy. Related Articles 
Invest better with The Motley Fool. Get stock recommendations, portfolio guidance, and more from The Motley Fool's premium services.
 Making the world smarter, happier, and richer.  1995 - 2024 The Motley Fool. All rights reserved. Market data powered by Xignite and Polygon.io. About The Motley Fool Our Services Around the Globe Free Tools Affiliates & Friends",POSITIVE
"We recently compiled a list of the 35 AI News You Should Not Miss. In this article, we are going to take a look at where Intel Corporation (NASDAQ:INTC) stands against the other AI stocks you should not miss. The AI industry is constantly evolving and investors are keeping a close eye on investments, advancements in […]",https://finance.yahoo.com/news/intel-corporation-intc-ranked-among-081158388.html?.tsrc=rss,"Fri, 11 Oct 2024 08:11:58 +0000","Intel Corporation (INTC) Ranked Among Lowest in UBS Quantamental Model for U.S. Tech, Lagging Behind Arista, Broadcom, and Oracle","We recently compiled a list of the 35 AI News You Should Not Miss. In this article, we are going to take a look at where Intel Corporation (NASDAQ:INTC) stands against the other AI stocks you should not miss. The AI industry is constantly evolving and investors are keeping a close eye on investments, advancements in AI capabilities, and new partnerships to keep pace with the continued rise of generative AI and integration into key industries. One of the most exciting developments in the field of AI over the past week has been the 2024 Nobel Prize in Physics, which was awarded to scientists John Hopfield and Geoffrey Hinton for their pioneering work in the field of machine learning. Hopfield, a researcher at Princeton University, gained recognition for developing an associative memory system, a neural network model capable of storing and reconstructing images or other data patterns. His work revolutionized how data patterns can be represented and recalled, marking significant progress in the field of artificial intelligence. Meanwhile, Hinton, a professor at the University of Toronto, pioneered a method for autonomously discovering data properties, enabling machines to perform tasks such as identifying specific elements within images. His contributions have been pivotal in advancing AI capacity for image recognition and pattern identification. Another notable report worthy of mention is a recent Reuters study into the funding that AI startups have attracted so far this year. The study highlights the $6.6 billion funding round for AI startup OpenAI recently that pushed the valuation of the company to more than $157 billion. It also spotlights other AI startups that have received more than $500 million in funding this year. These include xAI, CoreWeave, Scale AI, Figure AI, Groq, Mistral AI, and Cohere. They have raised $6 billion, $1.1 billion, $1 billion, $657 million, $640 million, $600 million, and $500 million in funding so far this year, respectively. The startups are all valued at more than $2.5 billion, with xAI, founded by Tesla chief Elon Musk, worth over $24 billion. A recent report by Goldman Sachs reveals that businesses worldwide are projected to spend nearly $1 trillion in the coming years on building AI infrastructure. The report underscores the massive scale of investment needed to meet the growing demand for AI technologies across various industries. In 2024 alone, venture capital firms have already completed around 200 deals with AI companies, pouring in nearly $22 billion in funding. The average size of these funding rounds exceeds $100 million, reflecting the increasing valuation of AI startups, which now often surpass $1 billion. Read more about these developments by accessing 30 Most Important AI Stocks According to BlackRock and Beyond the Tech Giants: 35 Non-Tech AI Opportunities. Our Methodology For this article, we selected AI stocks by combing through news articles, stock analysis, and press releases. These stocks are also popular among hedge funds. Why are we interested in the stocks that hedge funds pile into? The reason is simple: our research has shown that we can outperform the market by imitating the top stock picks of the best hedge funds. Our quarterly newsletters strategy selects 14 small-cap and large-cap stocks every quarter and has returned 275% since May 2014, beating its benchmark by 150 percentage points (see more details here). A technician soldering components for a semiconductor board. Number of Hedge Fund Holders: 75      Intel Corporation (NASDAQ:INTC) markets key technologies for smart devices. UBS analysts recently published their top and bottom ranking stocks in their quantamental model. The stocks are analyzed by quantamental signals such as CTA momentum, crowding, EPS growth, how interest rates affect the stocks, risk targeting signals, volatility, options volume, adjusted forward PE ratio, new orders, and earnings revisions. Intel was ranked amongst the lowest scoring stocks in the information technology sector in the United States. The three highest scoring stocks in this sector, per investment advisory UBS, included Arista Networks, Broadcom, and Oracle Corporation. Overall INTC ranks 19th on our list of the AI stocks you should not miss. While we acknowledge the potential of INTC as an investment, our conviction lies in the belief that some AI stocks hold greater promise for delivering higher returns, and doing so within a shorter timeframe. If you are looking for an AI stock that is more promising than INTC but that trades at less than 5 times its earnings, check out our report about the cheapest AI stock. READ NEXT: $30 Trillion Opportunity: 15 Best Humanoid Robot Stocks to Buy According to Morgan Stanley and Jim Cramer Says NVIDIA Has Become A Wasteland. Disclosure: None. This article is originally published at Insider Monkey. Sign in to access your portfolio",POSITIVE
